{
  "artifact_type": "qc",
  "canonical": false,
  "data": {
    "adapter_trimming": "not_performed; deterministic adapter-free fixture",
    "additional_qc_artifacts": [
      {
        "artifact_id": "qc_reads_1_fastqc_html",
        "bytes": 631530,
        "filename": "reads_1_fastqc.html",
        "role": "raw_qc_or_execution_evidence",
        "sha256": "5c60b3d5b2852b11a575debce389571dc7cae59401f27fe90193dc4896e80078"
      },
      {
        "artifact_id": "qc_reads_1_fastqc_zip",
        "bytes": 417361,
        "filename": "reads_1_fastqc.zip",
        "role": "raw_qc_or_execution_evidence",
        "sha256": "03ef6c3515102865599bbb1e712aca1907cb3fc7c6c527efbb04deb81e15a56c"
      },
      {
        "artifact_id": "qc_reads_2_fastqc_html",
        "bytes": 649562,
        "filename": "reads_2_fastqc.html",
        "role": "raw_qc_or_execution_evidence",
        "sha256": "92a792880599becbccb2f62aedea26a8b15d26a53c32b8c21992284ce21a5d7e"
      },
      {
        "artifact_id": "qc_reads_2_fastqc_zip",
        "bytes": 434067,
        "filename": "reads_2_fastqc.zip",
        "role": "raw_qc_or_execution_evidence",
        "sha256": "8111c995c42b8e517fb37d63e03fa8c6010e6e39a30eef99e0d8b847d1b38c56"
      },
      {
        "artifact_id": "qc_reads_lane2_1_fastqc_html",
        "bytes": 639214,
        "filename": "reads_lane2_1_fastqc.html",
        "role": "raw_qc_or_execution_evidence",
        "sha256": "0050fddd6bc2d798a0625d538b10e77237404e746a7551d72533f143e8e4a98f"
      },
      {
        "artifact_id": "qc_reads_lane2_1_fastqc_zip",
        "bytes": 415280,
        "filename": "reads_lane2_1_fastqc.zip",
        "role": "raw_qc_or_execution_evidence",
        "sha256": "7d8b8cc9860229f1d71e895c85735328c5ac93328baba2a07db37e4eace6379d"
      },
      {
        "artifact_id": "qc_reads_lane2_2_fastqc_html",
        "bytes": 641930,
        "filename": "reads_lane2_2_fastqc.html",
        "role": "raw_qc_or_execution_evidence",
        "sha256": "e743c4a5a92b7f6d7b8210a365a062c1451c41bbefb3791c8d8a9ed22badddeb"
      },
      {
        "artifact_id": "qc_reads_lane2_2_fastqc_zip",
        "bytes": 418293,
        "filename": "reads_lane2_2_fastqc.zip",
        "role": "raw_qc_or_execution_evidence",
        "sha256": "52e3b81ee6245f0944b6d269f9a1533d496365f6adef6ac072b4c828ee079efa"
      },
      {
        "artifact_id": "qc_SYNTHETIC01_mosdepth_global_dist_txt",
        "bytes": 129,
        "filename": "SYNTHETIC01.mosdepth.global.dist.txt",
        "role": "raw_qc_or_execution_evidence",
        "sha256": "35816ba4fa582b32b232c7d402dab3ff7f308184641f13d7dd403513f8afe997"
      },
      {
        "artifact_id": "qc_SYNTHETIC01_mosdepth_region_dist_txt",
        "bytes": 86,
        "filename": "SYNTHETIC01.mosdepth.region.dist.txt",
        "role": "raw_qc_or_execution_evidence",
        "sha256": "01ff866ad7d3b731d27099f00ac013050bff37bf0fd2efd9e9e5a3c1c273250d"
      },
      {
        "artifact_id": "qc_SYNTHETIC01_regions_bed_gz",
        "bytes": 269,
        "filename": "SYNTHETIC01.regions.bed.gz",
        "role": "raw_qc_or_execution_evidence",
        "sha256": "3f590f7438701d3443d08d8e277eef227fd9937ea2baabf2aba827fb2e2897fd"
      },
      {
        "artifact_id": "qc_SYNTHETIC01_regions_bed_gz_csi",
        "bytes": 127,
        "filename": "SYNTHETIC01.regions.bed.gz.csi",
        "role": "raw_qc_or_execution_evidence",
        "sha256": "a68547a8cb1abf389ff0764578c81793194bbf3784816e9498ed9ad76356d833"
      },
      {
        "artifact_id": "qc_SYNTHETIC01_thresholds_bed_gz",
        "bytes": 351,
        "filename": "SYNTHETIC01.thresholds.bed.gz",
        "role": "raw_qc_or_execution_evidence",
        "sha256": "5c301d353cb4e7c2139a448edcbd86cb01fdf1fbf5ecece3bfa6905df0e64b88"
      },
      {
        "artifact_id": "qc_SYNTHETIC01_thresholds_bed_gz_csi",
        "bytes": 129,
        "filename": "SYNTHETIC01.thresholds.bed.gz.csi",
        "role": "raw_qc_or_execution_evidence",
        "sha256": "f7e69d62886bf49b1a159b991762d2e61fdbbe5f78e030abc2772dda785d507e"
      },
      {
        "artifact_id": "qc_SYNTHETIC01_alignment_summary_metrics_txt",
        "bytes": 2374,
        "filename": "SYNTHETIC01.alignment_summary_metrics.txt",
        "role": "raw_qc_or_execution_evidence",
        "sha256": "89a75f0a1b74e6fd2fc85ee5c885ac93f512488587af362fb1a819a8a44526c5"
      },
      {
        "artifact_id": "qc_multiqc_report_html",
        "bytes": 2494227,
        "filename": "multiqc_report.html",
        "role": "raw_qc_or_execution_evidence",
        "sha256": "a6e644f1e7c8f7bfd103b69056eb45b5f00624c6cf32352434069a29c59d179d"
      },
      {
        "artifact_id": "command_SYNTHETIC01_apply_bqsr_command_sh",
        "bytes": 833,
        "filename": "SYNTHETIC01.apply_bqsr.command.sh",
        "role": "raw_qc_or_execution_evidence",
        "sha256": "62cbd30670b39ffe350809977889197465dc8f11002642aa221d9d640b175004"
      },
      {
        "artifact_id": "command_SYNTHETIC01_bam_summary_command_sh",
        "bytes": 1127,
        "filename": "SYNTHETIC01.bam_summary.command.sh",
        "role": "raw_qc_or_execution_evidence",
        "sha256": "a53d3483ed343d2789fb92548f0a62d0ba6957b56bed4fdc1ab4e4a667afd3e0"
      },
      {
        "artifact_id": "command_SYNTHETIC01_markdup_command_sh",
        "bytes": 858,
        "filename": "SYNTHETIC01.markdup.command.sh",
        "role": "raw_qc_or_execution_evidence",
        "sha256": "9717180e9aaadc0a5fb9011a2a8516c737cd85e88d4f64461f4dba2f81e317a2"
      },
      {
        "artifact_id": "command_SYNTHETIC01_merge_command_sh",
        "bytes": 665,
        "filename": "SYNTHETIC01.merge.command.sh",
        "role": "raw_qc_or_execution_evidence",
        "sha256": "c1f1a65adbeab498ef33657967cab2607cf121c8fa8b80e6fa8600c81101af96"
      },
      {
        "artifact_id": "command_SYNTHETIC01_mosdepth_command_sh",
        "bytes": 682,
        "filename": "SYNTHETIC01.mosdepth.command.sh",
        "role": "raw_qc_or_execution_evidence",
        "sha256": "4842e4f4eb976240ad18f75aa97b619f4de4fd10358f4a1ca9be833b65b838e6"
      },
      {
        "artifact_id": "command_SYNTHETIC01_picard_qc_command_sh",
        "bytes": 804,
        "filename": "SYNTHETIC01.picard_qc.command.sh",
        "role": "raw_qc_or_execution_evidence",
        "sha256": "51966b948201f6e87c3eebc31fc16b7f63d35cfee24fcb083cf6d66e80f72b5f"
      },
      {
        "artifact_id": "command_SYNTHETIC01_pre_bqsr_command_sh",
        "bytes": 741,
        "filename": "SYNTHETIC01.pre_bqsr.command.sh",
        "role": "raw_qc_or_execution_evidence",
        "sha256": "96875aa67243fd51c0a6e8392bfc554f86fe63aac4384d2c0e61d007f32d0a86"
      },
      {
        "artifact_id": "command_SYNTHETIC01_recalibrate_command_sh",
        "bytes": 759,
        "filename": "SYNTHETIC01.recalibrate.command.sh",
        "role": "raw_qc_or_execution_evidence",
        "sha256": "8280989bffd979069ed9718f15df3d8c988c6965d86f16ceb59d8ea3659d4030"
      },
      {
        "artifact_id": "command_SYN_L001_align_command_sh",
        "bytes": 719,
        "filename": "SYN_L001.align.command.sh",
        "role": "raw_qc_or_execution_evidence",
        "sha256": "22b4a75e849dd6e28bd46d9e87e8ffd85a8085d6036db03eeca81a50f77fff49"
      },
      {
        "artifact_id": "command_SYN_L001_fastq_validation_command_sh",
        "bytes": 1075,
        "filename": "SYN_L001.fastq_validation.command.sh",
        "role": "raw_qc_or_execution_evidence",
        "sha256": "7ca9243a3d8d101a7b447588090b45eb1017dc4123fb8ee1c353179df9e932e2"
      },
      {
        "artifact_id": "command_SYN_L001_fastqc_command_sh",
        "bytes": 578,
        "filename": "SYN_L001.fastqc.command.sh",
        "role": "raw_qc_or_execution_evidence",
        "sha256": "26bcdb438854b53c03b7f966e693e8e6d00ac76ed7174a65b39be6265fff91ff"
      },
      {
        "artifact_id": "command_SYN_L001_sort_command_sh",
        "bytes": 658,
        "filename": "SYN_L001.sort.command.sh",
        "role": "raw_qc_or_execution_evidence",
        "sha256": "a1ff0ae77ebffd55ead48274ea41800767b6f468cce7cf33f5edcb2423e62f43"
      },
      {
        "artifact_id": "command_SYN_L002_align_command_sh",
        "bytes": 731,
        "filename": "SYN_L002.align.command.sh",
        "role": "raw_qc_or_execution_evidence",
        "sha256": "06290d0291195839fec020b4faf31156581b295f3a5a742001df70a6bbcee4af"
      },
      {
        "artifact_id": "command_SYN_L002_fastq_validation_command_sh",
        "bytes": 1087,
        "filename": "SYN_L002.fastq_validation.command.sh",
        "role": "raw_qc_or_execution_evidence",
        "sha256": "f36794bac227f9e6db87d6dedbb3446518e691d8d76e31fd04a0866ed791a074"
      },
      {
        "artifact_id": "command_SYN_L002_fastqc_command_sh",
        "bytes": 590,
        "filename": "SYN_L002.fastqc.command.sh",
        "role": "raw_qc_or_execution_evidence",
        "sha256": "c179f8e228be8583c279112d03fe179fe14e54a7e8e85afe1050ea83b3c13fdc"
      },
      {
        "artifact_id": "command_SYN_L002_sort_command_sh",
        "bytes": 658,
        "filename": "SYN_L002.sort.command.sh",
        "role": "raw_qc_or_execution_evidence",
        "sha256": "881e1a401d2ac32d5e9c0b7cebabcebf09709ef676238e6150d50ff452e585b6"
      },
      {
        "artifact_id": "command_bwa_index_command_sh",
        "bytes": 601,
        "filename": "bwa_index.command.sh",
        "role": "raw_qc_or_execution_evidence",
        "sha256": "1e2bafeaf57c9f3f449a62fb46ac1d86bee6b457efe6622bf33ff0d6d0775a29"
      },
      {
        "artifact_id": "command_multiqc_command_sh",
        "bytes": 1162,
        "filename": "multiqc.command.sh",
        "role": "raw_qc_or_execution_evidence",
        "sha256": "f6ae4a6bd62b532dc6041f9a5660cf3303adfcaebba85b290ba1d822d77e3666"
      },
      {
        "artifact_id": "command_reference_faidx_command_sh",
        "bytes": 650,
        "filename": "reference_faidx.command.sh",